<?xml version="1.0" encoding="UTF-8"?>
<gestoría xmlns:xsi="http://www.w3.org/2001/XMLSchema-instance" xsi:noNamespaceSchemaLocation="gestoria.xsd">
    <sede codigo="A1234567">
        <codigo>A1234567</codigo>
        <nombreEmpleado>Juan Pérez</nombreEmpleado>
        <fechaAlta>2024-12-02</fechaAlta>
        <cliente codigo="AAA-112">
            <codigo>Insolvente</codigo> <!-- Cambio de 'codigoCliente' a 'codigo' -->
            <numeroViviendas>10</numeroViviendas>
            <vivienda ID="001">
                <coste>100</coste>
                <resumen>Producto muy frágil</resumen>
                <plazo>10</plazo>
            </vivienda>
            <vivienda ID="002">
                <coste>130</coste>
                <resumen>Producto nada frágil</resumen>
                <plazo>17</plazo>
            </vivienda>
            <vivienda ID="003">
                <coste>150</coste>
                <resumen>Producto resistente</resumen>
                <plazo>20</plazo>
            </vivienda>
            <vivienda ID="004">
                <coste>200</coste>
                <resumen>Producto de lujo</resumen>
                <plazo>25</plazo>
            </vivienda>
            <vivienda ID="005">
                <coste>250</coste>
                <resumen>Producto exclusivo</resumen>
                <plazo>30</plazo>
            </vivienda>
            <vivienda ID="006">
                <coste>300</coste>
                <resumen>Producto premium</resumen>
                <plazo>35</plazo>
            </vivienda>
            <vivienda ID="007">
                <coste>350</coste>
                <resumen>Producto de alta calidad</resumen>
                <plazo>40</plazo>
            </vivienda>
            <vivienda ID="008">
                <coste>400</coste>
                <resumen>Producto innovador</resumen>
                <plazo>45</plazo>
            </vivienda>
            <vivienda ID="009">
                <coste>450</coste>
                <resumen>Producto ecológico</resumen>
                <plazo>50</plazo>
            </vivienda>
            <vivienda ID="010">
                <coste>500</coste>
                <resumen>Producto sostenible</resumen>
                <plazo>55</plazo>
            </vivienda>
        </cliente>
    </sede>
</gestoría>
